{
  "accepted": true,
  "baselines": {
    "declared_controls": [
      "baseline_or_reference_check",
      "negative_control_where_applicable",
      "shape_dtype_or_exact_value_check",
      "attention_region_mass_control",
      "denoising_ablation_random_control",
      "latent_direction_random_control",
      "prompt_token_ablation_control",
      "pinned_sd_turbo_safetensors_generation",
      "deterministic_safe_shape_prompt_pair",
      "pinned_clip_prompt_alignment_scoring",
      "pinned_sd_turbo_cross_attention_capture",
      "target_token_vs_background_token_attention_control",
      "generated_color_shape_region_mask_control",
      "pinned_sd15_safetensors_generation",
      "sd15_daam_cross_attention_capture",
      "sd15_target_token_ablation_control",
      "sd15_random_token_ablation_control",
      "sd15_image_quality_metric",
      "sd15_white_noise_control"
    ],
    "expected_metrics": {
      "accepted": true,
      "latent_direction_effect": true,
      "max_allowed_gpu_gb": 24,
      "region_selective": true,
      "sd15_clip_image_to_text_accuracy": 1.0,
      "sd15_clip_mean_positive_margin_min": 2.0,
      "sd15_clip_text_to_image_accuracy": 1.0,
      "sd15_cross_attention_maps_captured": true,
      "sd15_daam_baseline_included": true,
      "sd15_fixed_seed_generation_passed": true,
      "sd15_image_quality_preserved": true,
      "sd15_max_high_frequency_energy_max": 0.12,
      "sd15_max_random_control_drop_max": 0.0,
      "sd15_mean_target_control_attention_gap_min": 0.01,
      "sd15_min_captured_cross_attention_map_count_min": 32,
      "sd15_min_target_ablation_drop_min": 0.05,
      "sd15_min_target_control_attention_gap_min": 0.005,
      "sd15_min_target_lift_over_mask_fraction_min": 0.01,
      "sd15_min_target_region_fraction_min": 0.02,
      "sd15_min_white_noise_high_frequency_gap_min": 0.12,
      "sd15_model_id": "stable-diffusion-v1-5/stable-diffusion-v1-5",
      "sd15_peak_vram_gb_max": 8.0,
      "sd15_random_token_ablation_weaker": true,
      "sd15_revision": "451f4fe16113bff5a5d2269ed5ad43b0592e9a14",
      "sd15_strict_experiment_passed": true,
      "sd15_token_ablation_passed": true,
      "sd15_white_noise_rejected": true,
      "sd_turbo_attention_resolutions": [
        8,
        16,
        32,
        64
      ],
      "sd_turbo_cross_attention_localized": true,
      "sd_turbo_image_to_text_accuracy": 1.0,
      "sd_turbo_mean_positive_margin_min": 2.0,
      "sd_turbo_mean_target_control_attention_gap_min": 0.03,
      "sd_turbo_min_captured_cross_attention_map_count_min": 16,
      "sd_turbo_min_target_control_attention_gap_min": 0.02,
      "sd_turbo_min_target_lift_over_mask_fraction_min": 0.02,
      "sd_turbo_peak_vram_gb_max": 8.0,
      "sd_turbo_preflight_passed": true,
      "sd_turbo_text_to_image_accuracy": 1.0,
      "tests_passed": true
    }
  },
  "claim_scope": "GT-1 toy diffusion/image-generation interpretability controls plus a required pinned safetensors Stable Diffusion 1.5 safe-shape preflight. The SD1.5 path captures DAAM-style cross-attention maps for color/shape tokens, verifies target-token attention over generated color regions against unrelated-token controls, ablates target prompt tokens over random/control-token ablations, preserves simple image-quality metrics, rejects white-noise controls, and scores generated images with pinned CLIP. A pinned SD-Turbo/CLIP attention preflight remains supplemental.",
  "datasets": [
    {
      "id": "13_1_diffusion_and_image_generation_controls_toy_inputs",
      "seed": 0,
      "source": "generated"
    },
    {
      "id": "course_generated_safe_shape_prompts_sd_turbo_v1",
      "image_size": "512x512",
      "prompt_count": 2,
      "prompts": [
        "red square icon on clean white background",
        "blue circle icon on clean white background"
      ],
      "seed": 0,
      "source": "generated_prompt_pair"
    },
    {
      "id": "course_generated_safe_shape_prompts_sd15_v1",
      "image_size": "512x512",
      "prompt_count": 2,
      "prompts": [
        "single centered solid red square on plain white background",
        "single centered solid blue circle on plain white background"
      ],
      "seed": "red_square=4;blue_circle=2",
      "source": "generated_prompt_pair"
    }
  ],
  "date_run": "2026-06-30T14:11:01+00:00",
  "evidence_level": "toy_prompt_region_controls_plus_pinned_sd15_daam_token_ablation_quality_preflight",
  "git_commit": "f9f034bd",
  "gpu_name": "NVIDIA GeForce RTX 5090 Laptop GPU",
  "gt_tier": "GT-1",
  "known_failures": [],
  "metrics": {
    "gpu_evidence": {
      "category": "cuda_section_metric",
      "placeholder_only": false,
      "section_specific_metric_keys": [
        "has_directional_effect",
        "latent_direction_effect",
        "latent_observed_delta",
        "latent_random_delta",
        "region_mass",
        "region_selective",
        "sd15_attention_resolutions",
        "sd15_case_reports",
        "sd15_clip_image_to_text_accuracy",
        "sd15_clip_mean_positive_margin",
        "sd15_clip_text_to_image_accuracy",
        "sd15_cross_attention_maps_captured",
        "sd15_daam_baseline_included",
        "sd15_fixed_seed_generation_passed",
        "sd15_image_quality_preserved",
        "sd15_max_high_frequency_energy",
        "sd15_max_random_control_drop",
        "sd15_mean_target_control_attention_gap",
        "sd15_min_captured_cross_attention_map_count",
        "sd15_min_target_ablation_drop",
        "sd15_min_target_control_attention_gap",
        "sd15_min_target_lift_over_mask_fraction",
        "sd15_min_target_region_fraction",
        "sd15_min_white_noise_high_frequency_gap",
        "sd15_model_id",
        "sd15_peak_vram_gb",
        "sd15_preflight",
        "sd15_random_token_ablation_weaker",
        "sd15_revision",
        "sd15_strict_experiment_passed",
        "sd15_token_ablation_passed",
        "sd15_white_noise_rejected",
        "sd_turbo_attention_resolutions",
        "sd_turbo_control_attention_region_masses",
        "sd_turbo_cross_attention_localized",
        "sd_turbo_image_to_text_accuracy",
        "sd_turbo_mean_positive_margin",
        "sd_turbo_mean_target_control_attention_gap",
        "sd_turbo_min_captured_cross_attention_map_count",
        "sd_turbo_min_target_control_attention_gap",
        "sd_turbo_min_target_lift_over_mask_fraction",
        "sd_turbo_peak_vram_gb",
        "sd_turbo_preflight",
        "sd_turbo_preflight_passed",
        "sd_turbo_target_attention_region_masses",
        "sd_turbo_text_to_image_accuracy"
      ],
      "uses_cuda": true
    },
    "gpu_test": {
      "cuda_available": true,
      "cuda_version": "13.2",
      "device": "NVIDIA GeForce RTX 5090 Laptop GPU",
      "full_path": "Validated diffusion attention region controls, latent-direction effects over random controls, pinned SD-Turbo safe-shape generation scored by real CLIP, SD-Turbo cross-attention localization, and pinned SD1.5 DAAM-style attention, target-token ablation, image-quality, and white-noise controls on deterministic safe shape prompts.",
      "gpu_total_memory_gb": 23.45965576171875,
      "has_directional_effect": true,
      "latent_direction_effect": true,
      "latent_observed_delta": 0.5999999940395355,
      "latent_random_delta": 0.04999999701976776,
      "peak_vram_gb": 3.126201629638672,
      "region_mass": 0.6000000238418579,
      "region_selective": true,
      "sd15_attention_resolutions": [
        8,
        16,
        32,
        64
      ],
      "sd15_case_reports": [
        {
          "attention_resolutions": [
            8,
            16,
            32,
            64
          ],
          "captured_cross_attention_map_count": 1008,
          "case_id": "red_square",
          "control_ablated_prompt": "a single centered solid red square, plain white foreground, flat vector icon, minimal geometric shape",
          "control_region_mass": 0.24278798699378967,
          "control_region_score": 0.3306083679199219,
          "control_terms": [
            "geometric"
          ],
          "control_token_positions": [
            17
          ],
          "daam_localized": true,
          "high_frequency_energy": 0.009409384801983833,
          "image_quality_preserved": true,
          "mask_fraction": 0.199951171875,
          "original_region_score": 0.19669342041015625,
          "prompt": "a single centered solid red square, plain white background, flat vector icon, minimal geometric shape",
          "random_control_drop": -0.13391494750976562,
          "random_token_ablation_weaker": true,
          "rgb_std": 0.19652694463729858,
          "saturation_fraction": 0.016585031524300575,
          "seed": 4,
          "target_ablated_prompt": "a single centered solid square, plain white background, flat vector icon, minimal geometric shape",
          "target_ablated_region_score": 0.000682830810546875,
          "target_ablation_passed": true,
          "target_color": "red",
          "target_control_gap": 0.04503345489501953,
          "target_drop": 0.19601058959960938,
          "target_lift_over_mask_fraction": 0.0878702700138092,
          "target_region_fraction": 0.19669342041015625,
          "target_region_mass": 0.2878214418888092,
          "target_terms": [
            "red",
            "square"
          ],
          "target_token_positions": [
            5,
            6
          ],
          "white_noise_high_frequency_energy": 0.33437636494636536,
          "white_noise_rejected": true
        },
        {
          "attention_resolutions": [
            8,
            16,
            32,
            64
          ],
          "captured_cross_attention_map_count": 1008,
          "case_id": "blue_circle",
          "control_ablated_prompt": "a single centered solid blue circle, plain white foreground, flat vector icon, minimal geometric shape",